{
  "$schema": "https://json-schema.org/draft/2020-12/schema",
  "$id": "https://devcareer-prep.local/schemas/career.schema.json",
  "title": "DevCareer Prep Career Statement",
  "description": "L1 경력 기술서(career.json). L0 evidence.json의 commits[].id만 인용하며 커밋 해시를 직접 쓰지 않는다. 정본은 이 JSON이며 사용자 대면 .md는 scripts/render-markdown.mjs의 렌더 산출물이다.",
  "type": "object",
  "additionalProperties": false,
  "required": [
    "schemaVersion", "generatedAt", "sourceRepoHead", "contentHash",
    "coverage", "truncated", "nodes"
  ],
  "properties": {
    "schemaVersion": { "$ref": "#/$defs/schemaVersion" },
    "generatedAt": { "type": "string", "format": "date-time" },
    "sourceRepoHead": {
      "type": "string",
      "pattern": "^[0-9a-f]{40}$",
      "description": "생성 시점 대상 레포 HEAD. AC-22 스테일 판정의 정본 값(레지스트리가 아니라 이 파일의 값)."
    },
    "contentHash": {
      "type": "string",
      "minLength": 1,
      "description": "이 파일 본문(generatedAt과 이 필드 자신은 제외)의 SHA-256 해시. 우발적 손상·부분 편집을 잡기 위한 필드이며, 키 없는 SHA-256이므로 해시까지 함께 재계산해 다시 써넣는 의도적 위조는 막지 못한다. 현재(P0 MVP) evidence.json은 scripts/verify-evidence.mjs·scripts/validate-plugin.mjs --schema-check가 이 방식으로 재계산·대조하지만(scripts/lib/content-hash.mjs), career.json을 비롯한 L1+ 산출물은 이를 쓰는 결정적 생성기가 아직 이 레포에 구현되어 있지 않다(skills/ 계층의 몫) — 즉 이 필드는 스키마가 요구하는 형태만 강제될 뿐, 이 레이어에서는 아직 재계산·대조되지 않는다."
    },
    "coverage": { "$ref": "#/$defs/coverage" },
    "truncated": { "$ref": "#/$defs/truncated" },
    "nodes": {
      "type": "array",
      "minItems": 1,
      "description": "경력 사실 주장 노드 목록. 노드가 0개인 산출물은 AC-13이 금지한 '빈손 출력'이다 — minItems로 스키마 레벨에서 막는다. FactChecker가 전 항목을 반증했더라도 항목 단위 강등(verification.status=refuted)으로 남겨 출력하며, 아무것도 내보내지 않는 경로는 없다.",
      "items": { "$ref": "#/$defs/careerNode" }
    }
  },
  "$defs": {
    "schemaVersion": {
      "type": "string",
      "pattern": "^\\d+\\.\\d+\\.\\d+$",
      "default": "0.1.0",
      "description": "이 산출물 형식의 버전."
    },
    "coverage": {
      "type": "object",
      "additionalProperties": false,
      "required": ["analyzed", "total", "traversed", "period", "exclusions", "samplingMethod"],
      "description": "AC-10: 산출물 헤더에 커버리지 메타데이터(분석/전체 커밋 수, 기간, 제외 규칙, 샘플링 방식, 범위 선택 결과) 필수 기재. evidence.json의 값을 그대로 복사한다.",
      "properties": {
        "analyzed": { "type": "integer", "minimum": 0, "description": "이 산출물에 반영된 커밋 수(excluded !== true 기준)." },
        "total": { "type": "integer", "minimum": 0, "description": "샘플링 모집단 크기(excluded !== true 커밋 수)." },
        "traversed": { "type": "integer", "minimum": 0, "description": "순회한 전 커밋 수(excluded:true 포함). analyzed/total과 동일 값이 될 수 없다." },
        "period": {
          "type": "object",
          "additionalProperties": false,
          "required": ["since", "until"],
          "properties": {
            "since": { "type": ["string", "null"], "format": "date" },
            "until": { "type": ["string", "null"], "format": "date" }
          }
        },
        "exclusions": {
          "type": "object",
          "additionalProperties": false,
          "required": ["bots", "vendoredPaths", "mergeIncluded", "selectedIdentities"],
          "properties": {
            "bots": { "type": "boolean" },
            "vendoredPaths": { "type": "boolean" },
            "mergeIncluded": { "type": "boolean" },
            "selectedIdentities": {
              "type": "array",
              "items": { "type": "string", "format": "email" },
              "description": "§5 저자 정체성 게이트에서 다중 선택된 identity 이메일 목록."
            }
          }
        },
        "samplingMethod": {
          "type": "string",
          "x-verbatim": true,
          "minLength": 1,
          "description": "절단 없으면 `none:full-scan`. 절단 시 evidence.json과 동일한 구현 5단계 정본 리터럴을 그대로 복사한다(재서술 금지)."
        }
      }
    },
    "truncated": {
      "type": "object",
      "additionalProperties": false,
      "required": ["reason", "dropped_commits"],
      "properties": {
        "reason": { "type": "string", "enum": ["none", "budget_commits"] },
        "dropped_commits": { "type": "integer", "minimum": 0 }
      },
      "allOf": [
        { "if": { "properties": { "reason": { "const": "none" } } }, "then": { "properties": { "dropped_commits": { "const": 0 } } } },
        { "if": { "properties": { "reason": { "const": "budget_commits" } } }, "then": { "properties": { "dropped_commits": { "minimum": 1 } } } }
      ]
    },
    "evidenceCitation": {
      "type": "object",
      "additionalProperties": false,
      "required": ["ledgerId"],
      "description": "evidence.json commits[].id 인용. 해시를 직접 쓰지 않는다.",
      "properties": {
        "ledgerId": {
          "type": "string",
          "minLength": 1,
          "description": "evidence.json의 commits[].id. verify-evidence.mjs가 이 ID로 원장을 조회해 실존성·경로를 검사한다."
        },
        "path": {
          "type": "string",
          "description": "정량 주장이 특정 파일 변경을 근거로 들 때의 경로(선택). AC-7 (c)축이 이 (ledgerId, path) 쌍을 diff 집합과 대조한다."
        }
      }
    },
    "basis": {
      "type": "string",
      "enum": ["commit", "inference", "external", "insufficient"],
      "description": "근거 등급. 정량 주장(기간·커밋 수·파일·라인)만 commit을 강제하고, 역할·기여 서술은 inference로 분리한다."
    },
    "verification": {
      "type": "object",
      "additionalProperties": false,
      "required": ["status", "attempts", "reasonCode"],
      "description": "2단 팩트체크(LLM 반증 판정)의 결과. basis와 **직교하는 별도 축**이다 — basis는 '이 주장이 어떤 등급의 근거를 갖는가'이고 이 필드는 '그 근거가 반증 시도를 견뎠는가'이다. 따라서 강등이 basis를 바꾸지 않는다. AC-13의 '근거 부족 - 미검증' 배지는 이 필드에서만 파생하며, 렌더 마크다운이 배지를 자기 판단으로 붙이지 않는다(정본은 JSON이고 마크다운은 그 뷰라는 §1 결정이 여기 걸려 있다). plan.schema.json의 verificationStatus와 이름이 비슷하지만 다른 축이다 — 그쪽은 생성된 문제의 신뢰 등급이고 이쪽은 사실 주장의 반증 결과다. 두 필드를 통합하지 마라.",
      "properties": {
        "status": {
          "type": "string",
          "enum": ["verified", "refuted", "not-attempted"],
          "description": "verified=FactChecker가 반증하지 못했다. refuted=재생성 상한(2회)까지 반증당해 강등됐다. not-attempted=아직 판정 대상이 아니었다. 'refuted'와 'not-attempted'를 구분하지 않으면 '검증을 시도했고 반증당함'과 '애초에 근거가 없음'이 같은 값으로 뭉개져, 재실행 시 재시도 상한이 초기화된다."
        },
        "attempts": {
          "type": "integer",
          "minimum": 0,
          "maximum": 2,
          "description": "이 노드에 대해 수행한 재생성 시도 횟수. spec.md §3이 상한을 2회로 고정했으므로 2를 넘을 수 없다. 재실행 시 기존 산출물의 값을 이어받는다 — 매 실행 0으로 초기화하면 상한이 사실상 무한이 된다."
        },
        "reasonCode": {
          "type": ["string", "null"],
          "pattern": "^[A-Z][A-Z0-9_]*$",
          "description": "강등 사유의 기계 판독 코드(예: NO_SUPPORTING_DIFF). status가 refuted가 아니면 null이다. 자유 서술이 아니므로 AC-19 언어 린트 대상이 아니며(x-freeText를 붙이지 않는다), AC-8 오염 스위트의 기대 REJECT 사유 문자열 대조에 그대로 쓸 수 있다. 사람이 읽을 설명이 필요하면 노드 text에 한국어로 적는다."
        }
      }
    },
    "careerNode": {
      "type": "object",
      "additionalProperties": false,
      "required": ["id", "basis", "evidence", "verification", "origin", "locked", "text"],
      "properties": {
        "id": {
          "type": "string",
          "minLength": 1,
          "pattern": "^[A-Za-z0-9:_-]+$",
          "description": "이 노드의 고유 ID. L2(지식맵) 노드가 parentRefs로 이 ID를 인용한다."
        },
        "basis": { "$ref": "#/$defs/basis" },
        "evidence": {
          "type": "array",
          "items": { "$ref": "#/$defs/evidenceCitation" },
          "description": "AC-12: evidence가 빈 배열이면 basis는 반드시 insufficient여야 한다(아래 if/then)."
        },
        "verification": { "$ref": "#/$defs/verification" },
        "origin": {
          "type": "string",
          "enum": ["generated", "user"],
          "description": "이 노드가 LLM 생성분인지 사용자 수동 추가분인지. **이 값은 병합·편집 감지 로직(구현 7단계)만 설정하며 생성 템플릿이 직접 기입하지 않는다** — LLM이 스스로 user를 적을 수 있으면 AC-19 언어 린트의 origin:user 제외가 곧 자기면제 통로가 된다."
        },
        "locked": {
          "type": "boolean",
          "description": "true면 재생성 시 이 노드를 건드리지 않는다(사용자 편집 보존, AC-16)."
        },
        "text": {
          "type": "string",
          "x-freeText": true,
          "description": "경력 사실 서술 본문(한국어로). 공백 구분 토큰 4개 이상인 서술형 값은 AC-19 언어 린트 대상이다."
        },
        "period": {
          "type": "object",
          "additionalProperties": false,
          "properties": {
            "start": { "type": "string", "format": "date" },
            "end": { "type": ["string", "null"], "format": "date" }
          },
          "description": "이 경력 항목이 걸친 기간(선택). 정량 주장이므로 basis:commit이면 evidence 인용이 필수다."
        },
        "skills": {
          "type": "array",
          "items": { "type": "string", "x-termField": true, "minLength": 1 },
          "description": "관련 기술 용어·고유명사 목록(예: Kafka Consumer Group). 언어 린트 제외 대상."
        }
      },
      "allOf": [
        {
          "if": { "properties": { "evidence": { "maxItems": 0 } } },
          "then": { "properties": { "basis": { "const": "insufficient" } } }
        },
        {
          "if": { "properties": { "verification": { "properties": { "status": { "const": "not-attempted" } } } } },
          "then": { "properties": { "verification": { "properties": { "attempts": { "const": 0 }, "reasonCode": { "type": "null" } } } } }
        },
        {
          "if": { "properties": { "verification": { "properties": { "status": { "const": "refuted" } } } } },
          "then": { "properties": { "verification": { "properties": { "attempts": { "const": 2 }, "reasonCode": { "type": "string", "minLength": 1 } } } } }
        },
        {
          "if": { "properties": { "verification": { "properties": { "status": { "const": "verified" } } } } },
          "then": { "properties": { "verification": { "properties": { "reasonCode": { "type": "null" } } } } }
        }
      ]
    }
  }
}
