{
  "schemaVersion": "0.1.0",
  "generatedAt": "2026-08-31T00:00:00.000Z",
  "sourceRepoHead": "51df5cbe58929884494c2e9b678df886985ea240",
  "contentHash": "3023308e712030c544dbf5c26bb1f3d7da7aa91bc6d430152365eb5f2ecc194a",
  "coverage": {
    "analyzed": 245,
    "total": 245,
    "traversed": 300,
    "period": {
      "since": null,
      "until": null
    },
    "exclusions": {
      "bots": true,
      "vendoredPaths": true,
      "mergeIncluded": false,
      "selectedIdentities": [
        "owner@devcareer-fixture.test"
      ]
    },
    "samplingMethod": "none:full-scan"
  },
  "truncated": {
    "reason": "none",
    "dropped_commits": 0
  },
  "nodes": [
    {
      "id": "ct-sb-01",
      "basis": "insufficient",
      "origin": "generated",
      "evidence": [],
      "text": "마스킹 우회 케이스 SB-01: AKIAIOSFODNN7EXAMPLE",
      "locked": false,
      "verification": {
        "status": "not-attempted",
        "attempts": 0,
        "reasonCode": null
      }
    }
  ]
}
