{
  "schemaVersion": "0.1.0",
  "generatedAt": "2026-08-31T00:00:00.000Z",
  "sourceRepoHead": "51df5cbe58929884494c2e9b678df886985ea240",
  "contentHash": "2a87bca7ec95258f9da7265d8f085cd432cfe25179e0b08e5c33d65c2f46eda5",
  "coverage": {
    "analyzed": 245,
    "total": 245,
    "traversed": 300,
    "period": {
      "since": null,
      "until": null
    },
    "exclusions": {
      "bots": true,
      "vendoredPaths": true,
      "mergeIncluded": false,
      "selectedIdentities": [
        "owner@devcareer-fixture.test"
      ]
    },
    "samplingMethod": "none:full-scan"
  },
  "truncated": {
    "reason": "none",
    "dropped_commits": 0
  },
  "nodes": [
    {
      "id": "ct-sb-03",
      "basis": "insufficient",
      "origin": "generated",
      "evidence": [],
      "text": "마스킹 우회 케이스 SB-03: -----BEGIN RSA PRIVATE KEY-----\nMIIEowIBAAKCAQEAxyz\n-----END RSA PRIVATE KEY-----",
      "locked": false,
      "verification": {
        "status": "not-attempted",
        "attempts": 0,
        "reasonCode": null
      }
    }
  ]
}
